id,name,brand,price,category,description,photo,url
18,ASUS VivoBook 15 R512FL i5-8265/12GB/512/Win10X MX250,ASUS,3099,2,"<div class='row text-center fresh-content'><div class='col-md-12'><div class='row text-left fresh-content'><div class='col-md-2 text-center'><img alt='ikona' class='ico' src='https://allegro.stati.pl/AllegroIMG/SZABLON/ICONS/laptop.svg'></div><div class='col-md-10'><h2 class='text-left'>Odkryj laptop uniwersalny Asus VivoBook 15 R512FL w 360 stopniach</h2><p>Poznaj ASUS VivoBook R512FL. Wyjątkową serię laptopów, która sprosta Twoim oczekiwaniom. Nowoczesny procesor Intel Core 8-tej generacji oraz dedykowana karta graficzna NVIDIA GeForce zagwarantują Ci optymalną wydajność. ASUS VivoBook R512FL sprawdzi się zarówno jako narzędzie do pracy biurowej, jak i centrum filmowo-gamingowej rozrywki. Podziwiaj naturalne kolory wyświetlane w rozdzielczości Full HD. Matowa powłoka matrycy zadba o to, by obraz był wyświetlany odpowiednio w każdych warunkach.</p><p>Sprawdź, jak Asus VivoBook 15 R512FL wygląda w rzeczywistości. Chwyć zdjęcie poniżej i przeciągnij je w lewo lub prawo, aby obrócić produkt, lub skorzystaj z przycisków nawigacyjnych.</p><div class='ov360'><div id='orbitvu'> </div></div><template><script type='text/javascript' src='https://blob.stati.pl/ov360/orbitvu12/swfobject.js'></script></template><template><script type='text/javascript' src='https://blob.stati.pl/ov360/orbitvu12/orbitvu.js'></script></template><template><script type='text/javascript'>        inject_orbitvu('orbitvu', 'https://blob.stati.pl/ov360/orbitvu12/orbitvuer12.swf', 'https://blob.stati.pl/ov360/orbitvu12/expressInstall.swf', {            ovus_folder: 'https://xkomstati.blob.core.windows.net/ov360/Systems/Asus/R512FL-BQ082/',            width: '100%',            content2: 'yes',            height: '100%'        });</script></template></div></div></div></div><div class='row text-left fresh-content'><div class='col-md-2 text-center'><img alt='ikona' class='ico' src='https://allegro.stati.pl/AllegroIMG/SZABLON/ICONS/laptop.svg'></div><div class='col-md-10'><h2 class='text-left'>Odkryj laptop uniwersalny Asus VivoBook 15 R512FL w 360 stopniach</h2><p>Poznaj ASUS VivoBook R512FL. Wyjątkową serię laptopów, która sprosta Twoim oczekiwaniom. Nowoczesny procesor Intel Core 8-tej generacji oraz dedykowana karta graficzna NVIDIA GeForce zagwarantują Ci optymalną wydajność. ASUS VivoBook R512FL sprawdzi się zarówno jako narzędzie do pracy biurowej, jak i centrum filmowo-gamingowej rozrywki. Podziwiaj naturalne kolory wyświetlane w rozdzielczości Full HD. Matowa powłoka matrycy zadba o to, by obraz był wyświetlany odpowiednio w każdych warunkach.</p><p>Sprawdź, jak Asus VivoBook 15 R512FL wygląda w rzeczywistości. Chwyć zdjęcie poniżej i przeciągnij je w lewo lub prawo, aby obrócić produkt, lub skorzystaj z przycisków nawigacyjnych.</p><div class='ov360'><div id='orbitvu'> </div></div><template><script type='text/javascript' src='https://blob.stati.pl/ov360/orbitvu12/swfobject.js'></script></template><template><script type='text/javascript' src='https://blob.stati.pl/ov360/orbitvu12/orbitvu.js'></script></template><template><script type='text/javascript'>        inject_orbitvu('orbitvu', 'https://blob.stati.pl/ov360/orbitvu12/orbitvuer12.swf', 'https://blob.stati.pl/ov360/orbitvu12/expressInstall.swf', {            ovus_folder: 'https://xkomstati.blob.core.windows.net/ov360/Systems/Asus/R512FL-BQ082/',            width: '100%',            content2: 'yes',            height: '100%'        });</script></template></div></div><div class='row text-left fresh-content'><div class='col-md-2 text-center'><img alt='monitor' class='ico' src='https://allegro.stati.pl/AllegroIMG/SZABLON/ICONS/monitor.svg'></div><div class='col-md-10'><h2 class='text-left'>Ekran NanoEdge</h2><p>VivoBook 15 inspiruje Cię do przekraczania granic. Nowa konstrukcja NanoEdge sprawia, że ekran laptopa VivoBook 15 jest niemalże bezramkowy i zapewnia użytkownikowi ogromną powierzchnię roboczą oraz ekstremalnie wciągające wrażenia wizualne podczas pracy i rozgrywki. Pomimo zastosowania ultrawąskiej oprawki, w jej górnej części znajduje się zintegrowana, wysokiej jakości kamera do prowadzenia wideoczatu z rodziną i przyjaciółmi.</p><img alt='Ekran NanoEdge' src='https://allegro.stati.pl/AllegroIMG/PRODUCENCI/ASUS/VivoBook-15-R512FA/01-laptop-asus.jpg'></div></div><div class='row text-left fresh-content'><div class='col-md-2 text-center'><img alt='obracany' class='ico' src='https://allegro.stati.pl/AllegroIMG/SZABLON/ICONS/obrot.svg'></div><div class='col-md-10'><h2 class='text-left'>Zawias ErgoLift</h2><p>Pokrywa laptopa VivoBook 15 to wrota do świata produktywności i ogromnych możliwości. Zastosowany w nim precyzyjnie zaprojektowany zawias ErgoLift charakteryzuje się wyjątkowo płynną pracą i podwójną funkcjonalnością: bezpiecznie utrzymuje pozycję ekranu pod dowolnym kątem nachylenia, a także unosi klawiaturę pod kątem 2°, aby za każdym razem zapewniać Ci idealną pozycję do pisania.</p><img alt='Zawias ErgoLift' src='https://allegro.stati.pl/AllegroIMG/PRODUCENCI/ASUS/VivoBook-15-R512FA/03-zawias-ergolift.jpg'></div></div><div class='row text-left fresh-content'><div class='col-md-2 text-center'><img alt='smukłość' class='ico' src='https://allegro.stati.pl/AllegroIMG/SZABLON/ICONS/smuklosc.svg'></div><div class='col-md-10'><h2 class='text-left'>Kompaktowe wymiary</h2><p>Zastosowanie nowego ekranu o bezramkowej konstrukcji NanoEdge ze wszystkich czterech stron pozwoliło zredukować wymiary do minimum, dzięki czemu VivoBook 15 dysponuje znacznie mniejszą obudową w porównaniu do swojego poprzednika. Zajmuje on mniej miejsca na Twoim biurku, uwalniając jednocześnie więcej przestrzeni dla Ciebie.</p><img alt='Kompaktowe wymiary' src='https://allegro.stati.pl/AllegroIMG/PRODUCENCI/ASUS/VivoBook-15-R512FA/04-kompaktowe-wymiary.jpg'></div></div><div class='row text-left fresh-content'><div class='col-md-2 text-center'><img alt='lekkość' class='ico' src='https://allegro.stati.pl/AllegroIMG/SZABLON/ICONS/lekkosc.svg'></div><div class='col-md-10'><h2 class='text-left'>Będzie Ci wszędzie towarzyszył</h2><p>Życie toczy się bardzo szybko, dlatego potrzebujesz laptopa, który nie będzie Cię spowalniał. VivoBook 15 oferuje kompaktowe wymiary ułatwiając podróżowanie, a także jest niewiarygodnie lekki – dzięki czemu możesz po prostu wsunąć go do swojej torby i korzystać z komputera w dowolnym miejscu.</p><img alt='lekka waga' src='https://allegro.stati.pl/AllegroIMG/PRODUCENCI/ASUS/VivoBook-15-R512FA/05-lekki.jpg'></div></div>","https://cdn.x-kom.pl/i/setup/images/prod/big/product-new-big,,2019/6/pr_2019_6_26_7_59_57_39_00.jpg",https://www.x-kom.pl/p/502802-notebook-laptop-156-asus-vivobook-15-r512fl-i5-8265-12gb-512-win10x-mx250.html
19,ASUS VivoBook S14 S430FA i5-8265U/8GB/256/Win10,ASUS,2799,4,"<div class='row text-center fresh-content'><div class='col-md-12'><div class='row text-center'><div class='col-md-12'><div class='row text-left fresh-content'><div class='col-md-2 text-center'><img alt='mysz' class='ico' src='https://allegro.stati.pl/AllegroIMG/SZABLON/ICONS/laptop.svg'></div><div class='col-md-10'><h2 class='text-left'>Odkryj ultramobilny laptop Asus VivoBook S14 S430FA w 360 stopniach</h2><p>Elegancko wykończony, efektowny, a jednocześnie minimalistyczny. Asus VivoBook S14 S430FA to laptop, który otwiera przed Tobą mobilne wrota, za którymi mnożą się nieskończone możliwości. Pracuj, oglądaj ulubione filmy i seriale, dziel się wrażeniami ze swoimi przyjaciółmi. Z ultramobilnym Asus VivoBook S14 S430FA zrobisz to, gdziekolwiek się znajdujesz. Jest lekki, niewielki i tylko czeka, aż zabierzesz go ze sobą w podróże małe i duże. </p><p>Sprawdź, jak Asus VivoBook S14 S430FA wygląda w rzeczywistości. Chwyć zdjęcie poniżej i przeciągnij je w lewo lub prawo aby obrócić produkt lub skorzystaj z przycisków nawigacyjnych.</p><div class='ov360'><div id='orbitvu'> </div></div><template><script type='text/javascript' src='https://blob.stati.pl/ov360/orbitvu12/swfobject.js'></script></template><template><script type='text/javascript' src='https://blob.stati.pl/ov360/orbitvu12/orbitvu.js'></script></template><template><script type='text/javascript'>        inject_orbitvu('orbitvu', 'https://blob.stati.pl/ov360/orbitvu12/orbitvuer12.swf', 'https://blob.stati.pl/ov360/orbitvu12/expressInstall.swf', {            ovus_folder: 'https://xkomstati.blob.core.windows.net/ov360/Systems/Asus/S430FA-EB488T/',            width: '100%',            content2: 'yes',            height: '100%'        });</script></template></div></div></div></div></div></div><div class='row text-left fresh-content'><div class='col-md-2 text-center'><img alt='mysz' class='ico' src='https://allegro.stati.pl/AllegroIMG/SZABLON/ICONS/laptop.svg'></div><div class='col-md-10'><h2 class='text-left'>Odkryj ultramobilny laptop Asus VivoBook S14 S430FA w 360 stopniach</h2><p>Elegancko wykończony, efektowny, a jednocześnie minimalistyczny. Asus VivoBook S14 S430FA to laptop, który otwiera przed Tobą mobilne wrota, za którymi mnożą się nieskończone możliwości. Pracuj, oglądaj ulubione filmy i seriale, dziel się wrażeniami ze swoimi przyjaciółmi. Z ultramobilnym Asus VivoBook S14 S430FA zrobisz to, gdziekolwiek się znajdujesz. Jest lekki, niewielki i tylko czeka, aż zabierzesz go ze sobą w podróże małe i duże. </p><p>Sprawdź, jak Asus VivoBook S14 S430FA wygląda w rzeczywistości. Chwyć zdjęcie poniżej i przeciągnij je w lewo lub prawo aby obrócić produkt lub skorzystaj z przycisków nawigacyjnych.</p><div class='ov360'><div id='orbitvu'> </div></div><template><script type='text/javascript' src='https://blob.stati.pl/ov360/orbitvu12/swfobject.js'></script></template><template><script type='text/javascript' src='https://blob.stati.pl/ov360/orbitvu12/orbitvu.js'></script></template><template><script type='text/javascript'>        inject_orbitvu('orbitvu', 'https://blob.stati.pl/ov360/orbitvu12/orbitvuer12.swf', 'https://blob.stati.pl/ov360/orbitvu12/expressInstall.swf', {            ovus_folder: 'https://xkomstati.blob.core.windows.net/ov360/Systems/Asus/S430FA-EB488T/',            width: '100%',            content2: 'yes',            height: '100%'        });</script></template></div></div><div class='row text-left fresh-content'><div class='col-md-2 text-center'><img alt='procesor' class='ico' src='https://allegro.stati.pl/AllegroIMG/SZABLON/ICONS/procesor.svg'></div><div class='col-md-10'><h2 class='text-left'>Procesor Intel Core i5 ósmej generacji</h2><p>Działaj z maksymalną wydajnością, dzięki mocy procesora Intel Core i5 ósmej generacji. Wprowadza technologię Intel Turbo Boost 2.0, która w inteligentny sposób podnosi taktowanie zegarów, zwiększając natychmiast wydajność CPU oraz dynamikę pracy laptopa. Tworzenie, edycja oraz udostępnianie multimediów, jak i obrazów sferycznych stanie się prostsze i mniej czasochłonne. Zamiast czekać – pracuj. Rób także zakupy w sieci, korzystając z zaawansowanych zabezpieczeń firmy Intel.</p><img alt='procesor i5 ósmej generacji' src='https://allegro.stati.pl/AllegroIMG/PRODUCENCI/ASUS/S430FA-EB488T/02-tyl.jpg'></div></div><div class='row text-left fresh-content'><div class='col-md-2 text-center'><img alt='grafika zintegrowana' class='ico' src='https://allegro.stati.pl/AllegroIMG/SZABLON/ICONS/grafikazintegrowana.svg'></div><div class='col-md-10'><h2 class='text-left'>Układ graficzny Intel® UHD Graphics</h2><p>Zobacz doskonały obraz, dzięki Intel UHD Graphics. Oglądaj filmy w porywającej jakości 4K, wyświetlając je na zewnętrznym ekranie. Edytuj zdjęcia i wideo przy użyciu profesjonalnych narzędzi, graj w gry, korzystaj z zaawansowanych technologii obrazu Intel. Zyskaj wydajność, jakiej potrzebujesz do pracy w lekkiej i mobilnej formie notebooka.</p><img alt='Intel UHD' src='https://allegro.stati.pl/AllegroIMG/PRODUCENCI/ASUS/S430FA-EB488T/04-klawiatura.jpg'></div></div><div class='row text-left fresh-content'><div class='col-md-2 text-center'><img alt='obracany' class='ico' src='https://allegro.stati.pl/AllegroIMG/SZABLON/ICONS/obrot.svg'></div><div class='col-md-10'><h2 class='text-left'>Zawias Ergolift</h2><p>Otwórz VivoBook S14, aby uzyskać świat wydajności i możliwości. Jego precyzyjnie skonstruowany zawias ErgoLift utrzymuje wyświetlacz bezpiecznie pod dowolnym kątem i lekko przechyla klawiaturę o 3,5 °, aby za każdym razem uzyskać idealną pozycję do pisania. Zawias ErgoLift poprawia również chłodzenie, aby zapewnić stabilną pracę komputera.</p><img alt='Zawias Ergolift' src='https://allegro.stati.pl/AllegroIMG/PRODUCENCI/ASUS/S430FA-EB488T/03-lewy-bok.jpg'></div></div><div class='row text-left fresh-content'><div class='col-md-2 text-center'><img alt='monitor' class='ico' src='https://allegro.stati.pl/AllegroIMG/SZABLON/ICONS/monitor.svg'></div><div class='col-md-10'><h2 class='text-left'>Ekran NanoEdge</h2><p>Nowy wyświetlacz NanoEdge w VivoBook S14 nadal przesuwa granice tego, co jest możliwe, nowy trójstronny wyświetlacz NanoEdge ma teraz jeszcze węższą ramkę wzdłuż górnej i bocznej części wyświetlacza. Dzięki temu stosunek ekranu do obudowy wynosi 84%, co zapewnia doskonałe wrażenia z oglądanego obrazu.</p><img alt='Ekran NanoEdge' src='https://allegro.stati.pl/AllegroIMG/PRODUCENCI/ASUS/S430FA-EB488T/05-przod.jpg'></div></div>","https://cdn.x-kom.pl/i/setup/images/prod/big/product-new-big,,2019/9/pr_2019_9_18_11_1_49_877_02.jpg",https://www.x-kom.pl/p/515687-notebook-laptop-141-asus-vivobook-s14-s430fa-i5-8265u-8gb-256-win10.html
20,Lenovo Legion Y540-15 i7-9750H/8GB/256 GTX1660Ti,Lenovo,4399,2,"<div class='row text-center fresh-content'><div class='col-md-12'><div class='row text-left fresh-content'><div class='col-md-2 text-center'><img alt='ikona' class='ico' src='https://allegro.stati.pl/AllegroIMG/SZABLON/ICONS/laptop.svg'></div><div class='col-md-10'><h2 class='text-left'>Odkryj Lenovo Legion Y540-15 w 360 stopniach</h2><p>Ten 15,6-calowy laptop zapewnia dokładnie to, czego potrzebujesz do jeszcze bardziej wciągającej i płynniejszej gry. Najpotężniejsza generacja mobilnych procesorów Intel Core i7 9-tej generacji to gwarancja najwyższej wydajności. Wyposażony w mocny układ graficzny Nvidia GTX1660Ti pozwoli Ci grać w najnowsze gry. Zdominuj pole bitwy, zamów swój egzemplarz już dziś.</p><p>Sprawdź, jak Lenovo Legion Y540-15 wygląda w rzeczywistości. Chwyć zdjęcie poniżej i przeciągnij je w lewo lub prawo, aby obrócić produkt, lub skorzystaj z przycisków nawigacyjnych.</p><div class='ov360'><div id='orbitvu'> </div></div><template><script type='text/javascript' src='https://blob.stati.pl/ov360/orbitvu12/swfobject.js'></script></template><template><script type='text/javascript' src='https://blob.stati.pl/ov360/orbitvu12/orbitvu.js'></script></template><template><script type='text/javascript'>        inject_orbitvu('orbitvu', 'https://blob.stati.pl/ov360/orbitvu12/orbitvuer12.swf', 'https://blob.stati.pl/ov360/orbitvu12/expressInstall.swf', {            ovus_folder: 'https://xkomstati.blob.core.windows.net/ov360/Systems/Lenovo/81SY007CPB/',            width: '100%',            content2: 'yes',            height: '100%'        });</script></template></div></div></div></div><div class='row text-left fresh-content'><div class='col-md-2 text-center'><img alt='ikona' class='ico' src='https://allegro.stati.pl/AllegroIMG/SZABLON/ICONS/laptop.svg'></div><div class='col-md-10'><h2 class='text-left'>Odkryj Lenovo Legion Y540-15 w 360 stopniach</h2><p>Ten 15,6-calowy laptop zapewnia dokładnie to, czego potrzebujesz do jeszcze bardziej wciągającej i płynniejszej gry. Najpotężniejsza generacja mobilnych procesorów Intel Core i7 9-tej generacji to gwarancja najwyższej wydajności. Wyposażony w mocny układ graficzny Nvidia GTX1660Ti pozwoli Ci grać w najnowsze gry. Zdominuj pole bitwy, zamów swój egzemplarz już dziś.</p><p>Sprawdź, jak Lenovo Legion Y540-15 wygląda w rzeczywistości. Chwyć zdjęcie poniżej i przeciągnij je w lewo lub prawo, aby obrócić produkt, lub skorzystaj z przycisków nawigacyjnych.</p><div class='ov360'><div id='orbitvu'> </div></div><template><script type='text/javascript' src='https://blob.stati.pl/ov360/orbitvu12/swfobject.js'></script></template><template><script type='text/javascript' src='https://blob.stati.pl/ov360/orbitvu12/orbitvu.js'></script></template><template><script type='text/javascript'>        inject_orbitvu('orbitvu', 'https://blob.stati.pl/ov360/orbitvu12/orbitvuer12.swf', 'https://blob.stati.pl/ov360/orbitvu12/expressInstall.swf', {            ovus_folder: 'https://xkomstati.blob.core.windows.net/ov360/Systems/Lenovo/81SY007CPB/',            width: '100%',            content2: 'yes',            height: '100%'        });</script></template></div></div><div class='row text-left fresh-content'><div class='col-md-2 text-center'><img alt='wytrzymałość' class='ico' src='https://allegro.stati.pl/AllegroIMG/SZABLON/ICONS/wytrzymalosc.svg'></div><div class='col-md-10'><h2 class='text-left'>Gaming w nowym stylu</h2><p>Koniec z topornymi laptopami gamingowymi. Wybierz laptop godny Ciebie — elegancki z zewnątrz i nieposkromiony wewnątrz. Laptop Lenovo Legion Y540 o grubości 3,1 cm i ważący 2,3 kg zapewnia idealną równowagę między spektakularną wydajnością gier a praktyczną mobilnością.</p><img alt='matryca ekran Legion' src='https://allegro.stati.pl/AllegroIMG/PRODUCENCI/LENOVO/Legion%20Y540-17/15/02-prawy-bok.jpg'></div></div><div class='row text-left fresh-content'><div class='col-md-2 text-center'><img alt='wydajność' class='ico' src='https://allegro.stati.pl/AllegroIMG/SZABLON/ICONS/wydajnosc.svg'></div><div class='col-md-10'><h2 class='text-left'>Jeszcze więcej mocy na milimetr</h2><p>O jakości wykonania świadczy nie tylko wygląd. Y540 to owoc tysięcy godzin pracy inżynierów, którzy mieli na celu zbudowanie laptopa nie tylko wydajnego, ale i smukłego. Specjaliści od baterii, rozmieszczenia gniazd, systemów termicznych i płyt głównych połączyli swoje siły, by pomieścić najlepszy sprzęt w wydajnym laptopie gamingowym.</p><img alt='Lenovo Legion płyta główna' src='https://allegro.stati.pl/AllegroIMG/PRODUCENCI/LENOVO/Legion%20Y540-17/15/03-lewy-bok.jpg'></div></div><div class='row text-left fresh-content'><div class='col-md-2 text-center'><img alt='chłodzenie' class='ico' src='https://allegro.stati.pl/AllegroIMG/SZABLON/ICONS/chlodzenie.svg'></div><div class='col-md-10'><h2 class='text-left'>Nadciąga zimny front</h2><p>Wysoka temperatura komputera to problem wielu graczy. Ty już nie musisz się nim przejmować dzięki technologii Legion Coldfront. System ten oferuje zalety dwukanałowego systemu termicznego, w tym indywidualne chłodzenie procesorów CPU i GPU, które obniża temperaturę komputera, cztery otwory wentylacyjne usprawniające obieg powietrza, dedykowane radiatory schładzające klawiaturę, a także po 70 łopatek wentylatorów na kanał w celu zmniejszenia poziomu hałasu.</p><img alt='Legion Chłodzenie Wentylatory' src='https://allegro.stati.pl/AllegroIMG/PRODUCENCI/LENOVO/Legion%20Y540-17/15/04-palmrest-klawiatura.jpg'></div></div><div class='row text-left fresh-content'><div class='col-md-2 text-center'><img alt='klawisze WSAD' class='ico' src='https://allegro.stati.pl/AllegroIMG/SZABLON/ICONS/WSAD.svg'></div><div class='col-md-10'><h2 class='text-left'>Wkrocz do akcji</h2><p>Intensywna wymiana ognia wymaga błyskawicznej reakcji, a klawiatura laptopa Legion Y540 oferuje najlepsze w swojej klasie funkcje sterowania grami, dzięki którym możesz zyskać przewagę nad każdym przeciwnikiem. Najwyższej klasy, pełnowymiarowa klawiatura zapobiega blokowaniu po naciśnięciu dowolnej liczby klawiszy, ma laserowo grawerowane klawisze WASD i białe podświetlenie. Reaguje w czasie krótszym niż 1 ms oraz oferuje wiele innych funkcji pełnej kontroli nad komputerem i grą. Y540 działa ze sterownikami Windows Precision umożliwiającymi sterowanie gestami, co ułatwia zarówno pracę, jak i korzystanie z rozrywki.</p><img alt='Program Legion Edge' src='https://allegro.stati.pl/AllegroIMG/PRODUCENCI/LENOVO/Legion%20Y540-17/15/05-pokrywa-matrycy-tylny-panel.jpg'></div></div><div class='row text-left fresh-content'><div class='col-md-2 text-center'><img alt='nowość' class='ico' src='https://allegro.stati.pl/AllegroIMG/SZABLON/ICONS/nowosc.svg'></div><div class='col-md-10'><h2 class='text-left'>Lenovo Premium Care</h2><p>Wybierz objęty promocją produkt Lenovo i zyskaj skrócony czas naprawy/wymiany gwarancyjnej w systemie door-to-door do 5 dni roboczych. Jedyne co musisz zrobić to zarejestrować swój zakup na <a href='https://lenovopremiumcare.pl/' target='_blank'><span style='color:blue'>stronie promocji</span></a> w ciągu 30 dni od daty zakupu.<br>Promocja na wybrane modele Lenovo trwa do 31.12.2019 r. Szczegóły akcji dostępne są w <a href='http://files.lenovopolska.pl/lenovo-premium-care-regulation.pdf' target='_blank'><span style='color:blue'>regulaminie</span></a>.</p><img alt='Lenovo Premium Care' src='https://allegro.stati.pl/AllegroIMG/PRODUCENCI/LENOVO/premium-care/00-gwarancja-lenovo-premium-care.jpg'></div></div>","https://cdn.x-kom.pl/i/setup/images/prod/big/product-new-big,,2018/7/pr_2018_7_30_22_9_28_870_04.jpg",https://www.x-kom.pl/p/506001-notebook-laptop-156-lenovo-legion-y540-15-i7-9750h-8gb-256-gtx1660ti.html
21,Crucial 16GB 3200MHz Ballistix Sport LT Gray CL16 (2x8GB),Crucial,389,5,"<div class='row text-left fresh-content'><div class='col-md-2 text-center'><img alt='DDR4' class='ico' src='https://allegro.stati.pl/AllegroIMG/SZABLON/ICONS/DDR4.svg'></div><div class='col-md-10'><h2 class='text-left'>Pamięć RAM DDR4 Crucial Ballistix Sport LT 2x8GB</h2><p>Linia Ballistix Sport LT została zaprojektowana dla zaawansowanych graczy i entuzjastów, będąc jednocześnie doskonałym rozwiązaniem dla początkujących. Moduły posiadają standardowe napięcia i czasy, co sprawia, że są to wysokiej jakości pamięci o wysokiej stabilności i szerokiej kompatybilności. Wyposażono je także w radiatory usprawniające chłodzenie</p><p>W celu zapewnienia najwyższej jakości pamięci RAM, Crucial współpracuje jedynie z najlepszymi dostawcami komponentów, a w produkcji modułów stosuje wyselekcjonowane kości pamięci światowych marek.</p><img alt='Pamięć RAM DDR4 Crucial 16GB 3200MHz Ballistix Sport LT Gray CL16 (2x8GB) BLS2K8G4D32AESBK' src='https://allegro.stati.pl/AllegroIMG/PRODUCENCI/CRUCIAL/Ballistix-Sport-LT/1-modul-x2.jpg'></div></div><div class='row text-left fresh-content'><div class='col-md-2 text-center'><img alt='pamięć RAM' class='ico' src='https://allegro.stati.pl/AllegroIMG/SZABLON/ICONS/RAM.svg'></div><div class='col-md-10'><h2 class='text-left'>Łatwa instalacja</h2><p>Pamięci Ballistix Sport nie wymagają trudnej konfiguracji BIOSu, możesz więc zacząć prace od razu po umieszczeniu ich w odpowiednich slotach. Moduły charakteryzują się też przystępną ceną, dzięki czemu możesz cieszyć się wysoką wydajnością nie posiadając olbrzymiego budżetu.</p><p>Dzięki niesamowicie szerokiej i różnorodnej ofercie firmy Crucial masz pewność, że w Twoje ręce trafiają produkty nie tylko o najwyższej niezawodności i jakości wykonania, ale także idealnie trafiające w Twoje potrzeby.</p><img alt='Crucial Ballistix Sport LT Radiator' src='https://allegro.stati.pl/AllegroIMG/PRODUCENCI/CRUCIAL/Ballistix-Sport-LT/2-radiator.jpg'></div></div>","https://cdn.x-kom.pl/i/setup/images/prod/big/product-new-big,,2019/2/pr_2019_2_25_14_11_11_252_01.jpg",https://www.x-kom.pl/p/481896-pamiec-ram-ddr4-crucial-16gb-3200mhz-ballistix-sport-lt-gray-cl16-2x8gb.html
