id,name,brand,price,category,description,photo,url
39,Lenovo Ideapad 330-15 Ryzen 3/8GB/256 ,Lenovo,1599,2,"<div class='row text-center fresh-content'><div class='col-md-12'><div class='row text-left fresh-content'><div class='col-md-2 text-center'><img alt='ikona' class='ico' src='https://allegro.stati.pl/AllegroIMG/SZABLON/ICONS/laptop.svg'></div><div class='col-md-10'><h2 class='text-left'>Odkryj uniwersalny laptop Lenovo Ideapad 330 w 360 stopniach</h2><p>Lenovo Ideapad 330 z ekranem o przekątnej 15,6” to idealny laptop do Twojego domu. Bez problemu poradzi sobie z wymogami stawianymi przez aplikacje biurowe, wykorzystasz go również jako domowe centrum rozrywki multimedialnej. Wydajna bateria pozwoli Ci na swobodne przemieszczanie między pokojami, bez konieczności rozwijania przewodu i szukania gniazdka. Po prostu usiądź wygodnie, czy to na kanapie, czy przed biurkiem i ciesz się możliwościami, jakie daje Lenovo Ideapad 330.</p><p>Sprawdź, jak Lenovo Ideapad 330 wygląda w rzeczywistości. Chwyć zdjęcie poniżej i przeciągnij je w lewo lub prawo, aby obrócić produkt, lub skorzystaj z przycisków nawigacyjnych.</p><div class='ov360'><div id='orbitvu'> </div></div><template><script type='text/javascript' src='https://blob.stati.pl/ov360/orbitvu12/swfobject.js'></script></template><template><script type='text/javascript' src='https://blob.stati.pl/ov360/orbitvu12/orbitvu.js'></script></template><template><script type='text/javascript'>        inject_orbitvu('orbitvu', 'https://blob.stati.pl/ov360/orbitvu12/orbitvuer12.swf', 'https://blob.stati.pl/ov360/orbitvu12/expressInstall.swf', {            ovus_folder: 'https://xkomstati.blob.core.windows.net/ov360/Systems/Lenovo/81D200DPPB/',            width: '100%',            content2: 'yes',            height: '100%'        });</script></template></div><p style='font-size: 11px; padding-bottom: 30px;'>*Zdjęcie poglądowe – laptop sprzedawany bez systemu operacyjnego</p></div></div></div><div class='row text-left fresh-content'><div class='col-md-2 text-center'><img alt='ikona' class='ico' src='https://allegro.stati.pl/AllegroIMG/SZABLON/ICONS/laptop.svg'></div><div class='col-md-10'><h2 class='text-left'>Odkryj uniwersalny laptop Lenovo Ideapad 330 w 360 stopniach</h2><p>Lenovo Ideapad 330 z ekranem o przekątnej 15,6” to idealny laptop do Twojego domu. Bez problemu poradzi sobie z wymogami stawianymi przez aplikacje biurowe, wykorzystasz go również jako domowe centrum rozrywki multimedialnej. Wydajna bateria pozwoli Ci na swobodne przemieszczanie między pokojami, bez konieczności rozwijania przewodu i szukania gniazdka. Po prostu usiądź wygodnie, czy to na kanapie, czy przed biurkiem i ciesz się możliwościami, jakie daje Lenovo Ideapad 330.</p><p>Sprawdź, jak Lenovo Ideapad 330 wygląda w rzeczywistości. Chwyć zdjęcie poniżej i przeciągnij je w lewo lub prawo, aby obrócić produkt, lub skorzystaj z przycisków nawigacyjnych.</p><div class='ov360'><div id='orbitvu'> </div></div><template><script type='text/javascript' src='https://blob.stati.pl/ov360/orbitvu12/swfobject.js'></script></template><template><script type='text/javascript' src='https://blob.stati.pl/ov360/orbitvu12/orbitvu.js'></script></template><template><script type='text/javascript'>        inject_orbitvu('orbitvu', 'https://blob.stati.pl/ov360/orbitvu12/orbitvuer12.swf', 'https://blob.stati.pl/ov360/orbitvu12/expressInstall.swf', {            ovus_folder: 'https://xkomstati.blob.core.windows.net/ov360/Systems/Lenovo/81D200DPPB/',            width: '100%',            content2: 'yes',            height: '100%'        });</script></template></div><p style='font-size: 11px; padding-bottom: 30px;'>*Zdjęcie poglądowe – laptop sprzedawany bez systemu operacyjnego</p></div><div class='row text-left fresh-content'><div class='col-md-2 text-center'><img alt='procesor' class='ico' src='https://allegro.stati.pl/AllegroIMG/SZABLON/ICONS/procesor.svg'></div><div class='col-md-10'><h2 class='text-left'>Procesor AMD Ryzen 3</h2><p>Inteligentne technologie procesora AMD Ryzen 3 pozwalają w pełni wykorzystać moc oraz wydajność jednostki, co przekłada się na efektywną pracę, płynną rozgrywkę z popularnymi grami oraz strumieniowanie wysokiej jakości multimediów. Ten nowoczesny procesor potrafi ponadto przewidzieć kolejne etapy funkcjonowania uruchamianych aplikacji, rezerwując tyle zasobów, ile potrzeba do ich sprawnej obsługi. Odznacza się przy tym niskim zapotrzebowaniem na energię, dzięki czemu laptop będzie dłużej pracować na samej baterii.</p><img alt='Procesor AMD Ryzen 3' src='https://allegro.stati.pl/AllegroIMG/PRODUCENCI/LENOVO/Ideapad-330-15/81D200N3PB/01-procesor-amd.jpg'></div></div><div class='row text-left fresh-content'><div class='col-md-2 text-center'><img alt='zintegrowany układ graficzny' class='ico' src='https://allegro.stati.pl/AllegroIMG/SZABLON/ICONS/grafikazintegrowana.svg'></div><div class='col-md-10'><h2 class='text-left'>Grafika AMD Radeon Vega 3</h2><p>AMD Radeon Vega 3 to niesamowicie wydajny, zintegrowany układ graficzny, który zapewnia fenomenalną obsługę popularnych gier, filmów w wysokiej rozdzielczości oraz akcelerację stron internetowych. Układ wspiera środowisko DirectX 12 eksponując najdrobniejsze detale i wypełniając nimi ekran laptopa. Ponieważ powstał w 14nm procesie technologicznym zużywa niewiele energii, oszczędzając baterię w notebooku.</p><img alt='Grafika AMD Radeon Vega 3' src='https://allegro.stati.pl/AllegroIMG/PRODUCENCI/LENOVO/Ideapad-330-15/81D200N3PB/02-grafika-amd.jpg'></div></div><div class='row text-left fresh-content'><div class='col-md-2 text-center'><img alt='matowy ekran' class='ico' src='https://allegro.stati.pl/AllegroIMG/SZABLON/ICONS/matowyekran.svg'></div><div class='col-md-10'><h2 class='text-left'>Matowa matryca</h2><p>Irytuje Cię fakt, że na ekranie monitora lepiej widzisz swoją twarz niż swój ulubiony film? Zmień to i zdecyduj się na notebooka z matową matrycą która zapewni doskonałe warunki pracy – nawet w nasłonecznionych miejscach. Pracujesz wiele godzin przed ekranem komputera? Przekonaj się, że matowa matryca mniej męczy wzrok.</p><img class='hidden-xs' src='https://allegro.stati.pl/AllegroIMG/SZABLON/POZOSTALE/matowy-lg.png'> <img class='hidden-lg hidden-md hidden-sm' src='https://allegro.stati.pl/AllegroIMG/SZABLON/POZOSTALE/matowy-xs.png'></div></div><div class='row text-left fresh-content'><div class='col-md-2 text-center'><img alt='multimedia' class='ico' src='https://allegro.stati.pl/AllegroIMG/SZABLON/ICONS/film.svg'></div><div class='col-md-10'><h2 class='text-left'>Realistyczny, wyraźny obraz i pełne, ciepłe brzmienie</h2><p>Ideapad 330 wyświetla efektowny obraz na 15,6-calowym wyświetlaczu o rozdzielczości do Full HD. W połączeniu z technologią Dolby Audio™ Ideapad 330 oferuje znakomitą rozrywkę. Nawet na wyższych poziomach głośności usłyszysz każdy szczegół bez zakłóceń.</p><img alt='Realistyczny, wyraźny obraz i pełne, ciepłe brzmienie' src='https://allegro.stati.pl/AllegroIMG/PRODUCENCI/LENOVO/Ideapad-330-15/81D200N3PB/03-ekran-full-hd.jpg'></div></div><div class='row text-left fresh-content'><div class='col-md-2 text-center'><img alt='wytrzymałość' class='ico' src='https://allegro.stati.pl/AllegroIMG/SZABLON/ICONS/wytrzymalosc.svg'></div><div class='col-md-10'><h2 class='text-left'>Wytrzymały laptop z odpowiednią wentylacją</h2><p>Laptop to nie tylko urządzenie elektroniczne, ale i inwestycja. Dlatego Ideapad 330 pokryty został specjalną powłoką chroniącą laptop przed zniszczeniem. Ponadto dodane zostały gumowe detale na dolnej obudowie, aby zmaksymalizować wentylację i wydłużyć okres eksploatacji elementów komputera.</p><img alt='Wytrzymały laptop z odpowiednią wentylacją' src='https://allegro.stati.pl/AllegroIMG/PRODUCENCI/LENOVO/Ideapad-330-15/81D200N3PB/04-wytrzymalosc.jpg'></div></div><div class='row text-left fresh-content'><div class='col-md-2 text-center'><img alt='WiFi' class='ico' src='https://allegro.stati.pl/AllegroIMG/SZABLON/ICONS/wifi.svg'></div><div class='col-md-10'><h2 class='text-left'>Szybka łączność</h2><p>Lenovo Ideapad 330 to również szeroka gama portów. Aby sprawnie i szybko łączyć się z innymi urządzeniami zewnętrznymi bądź szybko przenosić wielkie dane, laptop ten został wyposażony m.in. w port HDMI, USB 3.1 bądź czytnik kart pamięci, Do dyspozycji masz ponadto łączność Wi-Fi, Bluetooth oraz LAN.</p><img alt='Szybka łączność' src='https://allegro.stati.pl/AllegroIMG/PRODUCENCI/LENOVO/Ideapad-330-15/81D200N3PB/05-lacznosc.jpg'></div></div>","https://cdn.x-kom.pl/i/setup/images/prod/big/product-new-big,,2018/9/pr_2018_9_12_11_48_44_990_02.jpg",https://www.x-kom.pl/p/489375-notebook-laptop-156-lenovo-ideapad-330-15-ryzen-3-8gb-256.html
40,HyperX 8GB 3200MHz Predator RGB CL16,HyperX,229,5,"<div class='row text-left fresh-content'><div class='col-md-2 text-center'><img alt='DDR4' class='ico' src='https://allegro.stati.pl/AllegroIMG/SZABLON/ICONS/DDR4.svg'></div><div class='col-md-10'><h2 class='text-left'>Pamięć RAM DDR4 HyperX Predator RGB 8GB</h2><p>Jeżeli szukasz ekstra wydajności niezbędnej do utrzymania się na topie, ultraszybka pamięć HyperX Predator DDR4 RGB zapewni Ci niezbędną przewagę. Ciesz się wyższymi ustawieniami grafiki, bezproblemowo odbieraj strumienie multimediów i błyskawicznie renderuj najważniejsze momenty. Drapieżny, czarny radiator pamięci Predator DDR4 zapewnia zarówno doskonałe chłodzenie jak i nietuzinkowy wygląd.</p><img alt='Pamięć RAM DDR4 HyperX 8GB 3200MHz Predator RGB CL16 HX432C16PB3A/8' src='https://allegro.stati.pl/AllegroIMG/PRODUCENCI/HyperX/Predator%20RGB/f1.jpg'></div></div><div class='row text-left fresh-content'><div class='col-md-2 text-center'><img alt='pamięć RAM' class='ico' src='https://allegro.stati.pl/AllegroIMG/SZABLON/ICONS/RAM.svg'></div><div class='col-md-10'><h2 class='text-left'>Zweryfikowane profile Intel XMP</h2><p>Profile Intel XMP zostały zoptymalizowane dla najnowszych chipsetów Intela i są zgodne z wieloma najnowszymi chipsetami AMD – po prostu wybierz jeden z nich i graj. Pamięci przechodzą gruntowne fabryczne testy prędkości i są objęte wieczystą gwarancją. A to znaczy jedno – Predator DDR4 RGB łączy w sobie dwie ważne cechy: ekstremalną wydajność i maksymalną niezawodność.</p><img alt='HyperX Predator RGB Profile XMP' src='https://allegro.stati.pl/AllegroIMG/PRODUCENCI/HyperX/Predator%20RGB/f2.jpg'></div></div><div class='row text-left fresh-content'><div class='col-md-2 text-center'><img alt='podświetlana klawiatura' class='ico' src='https://allegro.stati.pl/AllegroIMG/SZABLON/ICONS/podswietlanaklawiatura.svg'></div><div class='col-md-10'><h2 class='text-left'>Dynamiczne efekty RGB</h2><p>Pamięć Predator DDR4 to zastrzyk zachwycającego stylu dla każdego systemu. Jego wygląd możesz zmieniać przy użyciu oprogramowania do sterowania podświetleniem RGB płyty głównej, takimi jak ASUS Aura Sync, MSI Mystic Light czy GIGABYTE RGB Fusion. Następnie zsynchronizuj te wszystkie ustawienia dzięki bezprzewodowej technologii synchronizacji podczerwienią HyperX.</p><img alt='HyperX Predator RGB Podświetlenie' src='https://allegro.stati.pl/AllegroIMG/PRODUCENCI/HyperX/Predator%20RGB/f3.jpg'></div></div><div class='row text-left fresh-content'><div class='col-md-2 text-center'><img class='ico' src='https://allegro.stati.pl/AllegroIMG/SZABLON/ICONS/klip.svg'></div><div class='col-md-10'><h2 class='text-left'>HyperX Predator RGB</h2><p>Poznaj najważniejsze cechy wyjątkowej pamięci HyperX Predator DDR4 RGB. Przekonaj się, jak stylowo prezentuje się ona w obudowie komputera, oglądając poniższy materiał wideo.</p><div class='video-container' style='position:relative;padding-bottom:56.25%; background: none; margin: 30px 0 40px 0;height:0;overflow:hidden;border-radius: 30px'><div class='embed-responsive embed-responsive-16by9'><iframe class='embed-responsive-item' src='https://www.youtube.com/embed/L75sY8KBwt4?rel=0&amp;controls=0&amp;showinfo=0' style='position:absolute;top:0;left:0;width:100%;height:100%;border:none;'></iframe></div></div></div></div>","https://cdn.x-kom.pl/i/setup/images/prod/big/product-new-big,,2018/10/pr_2018_10_19_13_24_58_20_03.jpg",https://www.x-kom.pl/p/457709-pamiec-ram-ddr4-hyperx-8gb-3200mhz-predator-rgb-cl16.html
41,Acer Nitro 5 i7-9750H/16GB/512/Win10 GTX1660Ti IPS,Acer,5199,2,"<div class='row text-center fresh-content'><div class='col-md-12'><div class='row text-left fresh-content'><div class='col-md-2 text-center'><img alt='ikona' class='ico' src='https://allegro.stati.pl/AllegroIMG/SZABLON/ICONS/laptop.svg' style='height:95px; width:95px'></div><div class='col-md-10'><h2 class='text-left'>Odkryj laptopa gamingowego Acer Nitro 5 w 360 stopniach</h2><p>15,6-calowy Acer Nitro 5 oferuje dokładnie to, czego potrzebujesz, aby zdominować pola wirtualnych bitew. Najpotężniejsza generacja mobilnych procesorów Intel Core i7 9. generacji łączy się z układem graficznym Nvidia GeForce GTX o nieprzeciętnej mocy, aby zapewnić Ci płynną, komfortową rozgrywkę nawet w najnowszych tytułach. Wejdź do gry, poczuj smak rywalizacji na najwyższym poziomie.</p><p>Sprawdź, jak Acer Nitro 5 wygląda w rzeczywistości. Chwyć zdjęcie poniżej i przeciągnij je w lewo lub prawo, aby obrócić produkt, lub skorzystaj z przycisków nawigacyjnych.</p><div class='ov360'><div id='orbitvu'> </div></div><template><script type='text/javascript' src='https://blob.stati.pl/ov360/orbitvu12/swfobject.js'></script></template><template><script type='text/javascript' src='https://blob.stati.pl/ov360/orbitvu12/orbitvu.js'></script></template><template><script type='text/javascript'>        inject_orbitvu('orbitvu', 'https://blob.stati.pl/ov360/orbitvu12/orbitvuer12.swf', 'https://blob.stati.pl/ov360/orbitvu12/expressInstall.swf', {            ovus_folder: 'https://xkomstati.blob.core.windows.net/ov360/Systems/Acer/NH.Q5BEP.044/',            width: '100%',            content2: 'yes',            height: '100%'        });</script></template></div></div></div></div><div class='row text-left fresh-content'><div class='col-md-2 text-center'><img alt='ikona' class='ico' src='https://allegro.stati.pl/AllegroIMG/SZABLON/ICONS/laptop.svg' style='height:95px; width:95px'></div><div class='col-md-10'><h2 class='text-left'>Odkryj laptopa gamingowego Acer Nitro 5 w 360 stopniach</h2><p>15,6-calowy Acer Nitro 5 oferuje dokładnie to, czego potrzebujesz, aby zdominować pola wirtualnych bitew. Najpotężniejsza generacja mobilnych procesorów Intel Core i7 9. generacji łączy się z układem graficznym Nvidia GeForce GTX o nieprzeciętnej mocy, aby zapewnić Ci płynną, komfortową rozgrywkę nawet w najnowszych tytułach. Wejdź do gry, poczuj smak rywalizacji na najwyższym poziomie.</p><p>Sprawdź, jak Acer Nitro 5 wygląda w rzeczywistości. Chwyć zdjęcie poniżej i przeciągnij je w lewo lub prawo, aby obrócić produkt, lub skorzystaj z przycisków nawigacyjnych.</p><div class='ov360'><div id='orbitvu'> </div></div><template><script type='text/javascript' src='https://blob.stati.pl/ov360/orbitvu12/swfobject.js'></script></template><template><script type='text/javascript' src='https://blob.stati.pl/ov360/orbitvu12/orbitvu.js'></script></template><template><script type='text/javascript'>        inject_orbitvu('orbitvu', 'https://blob.stati.pl/ov360/orbitvu12/orbitvuer12.swf', 'https://blob.stati.pl/ov360/orbitvu12/expressInstall.swf', {            ovus_folder: 'https://xkomstati.blob.core.windows.net/ov360/Systems/Acer/NH.Q5BEP.044/',            width: '100%',            content2: 'yes',            height: '100%'        });</script></template></div></div><div class='row text-left fresh-content'><div class='col-md-2 text-center'><img alt='wydajność' class='ico' src='https://allegro.stati.pl/AllegroIMG/SZABLON/ICONS/wydajnosc.svg'></div><div class='col-md-10'><h2 class='text-left'>Doskonałe parametry techniczne</h2><p>Dzięki procesorowi Intel® Core™ i7 dziewiątej generacji i karcie graficznej NVIDIA® GeForce® GTX 1660Ti zawładniesz nad światem gier. Mocne dyski i pamięci RAM DDR4 zapewniają maksymalną szybkość i ogromną ilość miejsca. Duża pojemność akumulatora zapewnia dłuższy okres eksploatacji.</p><img alt='Procesor i karta graficzna' src='https://allegro.stati.pl/AllegroIMG/PRODUCENCI/ACER/Nitro-5/02-procesor.jpg'></div></div><div class='row text-left fresh-content'><div class='col-md-2 text-center'><img alt='technologia' class='ico' src='https://allegro.stati.pl/AllegroIMG/SZABLON/ICONS/technologia.svg'></div><div class='col-md-10'><h2 class='text-left'>Zachowaj zimną krew pod ostrzałem</h2><p>Gdy praca w ciężkich warunkach wymaga dodatkowej mocy, dwa wentylatory, technologia Acer CoolBoost™ oraz podwójny porty wylotowy stają na wysokości zadania. Technologia CoolBoost™ zwiększa prędkość wentylatora o 10%, a chłodzenie procesora i procesora graficznego – o 9% w porównaniu z trybem automatycznym. Technologia NitroSense umożliwia monitorowanie systemu i zarządzenie nim w czasie rzeczywistym – kontroluje m.in. temperaturę oraz szybkość wentylatora.</p><img alt='Chłodzenie' src='https://allegro.stati.pl/AllegroIMG/PRODUCENCI/ACER/Nitro-5/03-chlodzenie.jpg'></div></div><div class='row text-left fresh-content'><div class='col-md-2 text-center'><img alt='podświetlana klawiatura' class='ico' src='https://allegro.stati.pl/AllegroIMG/SZABLON/ICONS/podswietlanaklawiatura.svg'></div><div class='col-md-10'><h2 class='text-left'>Klucz do zwycięstwa</h2><p>Polecenia są łatwo dostępne dzięki specjalnemu przyciskowi NitroSense, natomiast przyciski WASD i strzałki są wyróżnione, co ułatwia ich lokalizację. Korzystaj klawiszy o skoku o wysokości 1,6 mm. Dodaj trochę emocji do rozgrywki i graj w półmroku dzięki klawiaturze o czerwonym podświetleniu.</p><img alt='Podświetlana klawiatura' src='https://allegro.stati.pl/AllegroIMG/PRODUCENCI/ACER/Nitro-5/04-podswietlana-klawiatura.jpg'></div></div><div class='row text-left fresh-content'><div class='col-md-2 text-center'><img alt='głośniki stereo' class='ico' src='https://allegro.stati.pl/AllegroIMG/SZABLON/ICONS/glosnikistereo.svg'></div><div class='col-md-10'><h2 class='text-left'>Przełamywanie bariery dźwięku</h2><p>Lepszy dźwięk zapewnia przewagę nad przeciwnikami, a także bardziej realistyczne wrażenia. Dodaj energii rozgrywce i ciesz się potężnym dźwiękiem dzięki oprogramowaniu Waves MaxxAudio® i technologii Acer TrueHarmony™. Waves MaxxAudio® zapewnia inteligentne wzmocnienie basów, dialogów i głośności, natomiast technologia Acer TrueHarmony™ – głębsze i bogatsze brzmienie.</p><img alt='Dźwięk' src='https://allegro.stati.pl/AllegroIMG/PRODUCENCI/ACER/Nitro-5/05-dzwiek.jpg'></div></div>","https://cdn.x-kom.pl/i/setup/images/prod/big/product-new-big,,2019/5/pr_2019_5_17_10_39_51_956_08.jpg",https://www.x-kom.pl/p/496139-notebook-laptop-156-acer-nitro-5-i7-9750h-16gb-512-win10-gtx1660ti-ips.html
42,Acer Swift 3 i5-8265U/8GB/512/Win10 FHD IPS MX250 Blue,Acer,2899,4,"<div class='row text-center fresh-content'><div class='col-md-12'><div class='row text-left fresh-content'><div class='col-md-2 text-center'><img alt='ikona' class='ico' src='https://allegro.stati.pl/AllegroIMG/SZABLON/ICONS/laptop.svg'></div><div class='col-md-10'><h2 class='text-left'>Odkryj laptop ultramobilny Acer Swift 3 w 360 stopniach</h2><p>Elegancja do pary z wygodą użytkowania? To właśnie oferuje ultramobilny laptop Acer Swift 3, który świetnie sprawdzi się zarówno jako narzędzie do pracy, jak i multimedialne centrum rozrywki, na którym zobaczysz kolejne sezony swoich ulubionych seriali. Do dyspozycji masz również inteligentne rozwiązania; na przykład czytnik linii papilarnych, za sprawą którego zalogujesz się do swojego Acer Swift 3 w mgnieniu oka. Smukła konstrukcja oraz waga zaledwie 1,42 kg pozwoli Ci zabrać go ze sobą wszędzie, gdzie zechcesz. Zaufaj mobilności bez kompromisów.</p><p>Sprawdź, jak Acer Swift 3 wygląda w rzeczywistości. Chwyć zdjęcie poniżej i przeciągnij je w lewo lub prawo, aby obrócić produkt, lub skorzystaj z przycisków nawigacyjnych.</p><div class='ov360'><div id='orbitvu'> </div></div><template><script type='text/javascript' src='https://blob.stati.pl/ov360/orbitvu12/swfobject.js'></script></template><template><script type='text/javascript' src='https://blob.stati.pl/ov360/orbitvu12/orbitvu.js'></script></template><template><script type='text/javascript'>        inject_orbitvu('orbitvu', 'https://blob.stati.pl/ov360/orbitvu12/orbitvuer12.swf', 'https://blob.stati.pl/ov360/orbitvu12/expressInstall.swf', {            ovus_folder: 'https://xkomstati.blob.core.windows.net/ov360/Systems/Acer/NX.HBBEP.001/',            width: '100%',            content2: 'yes',            height: '100%'        });</script></template></div></div></div></div><div class='row text-left fresh-content'><div class='col-md-2 text-center'><img alt='ikona' class='ico' src='https://allegro.stati.pl/AllegroIMG/SZABLON/ICONS/laptop.svg'></div><div class='col-md-10'><h2 class='text-left'>Odkryj laptop ultramobilny Acer Swift 3 w 360 stopniach</h2><p>Elegancja do pary z wygodą użytkowania? To właśnie oferuje ultramobilny laptop Acer Swift 3, który świetnie sprawdzi się zarówno jako narzędzie do pracy, jak i multimedialne centrum rozrywki, na którym zobaczysz kolejne sezony swoich ulubionych seriali. Do dyspozycji masz również inteligentne rozwiązania; na przykład czytnik linii papilarnych, za sprawą którego zalogujesz się do swojego Acer Swift 3 w mgnieniu oka. Smukła konstrukcja oraz waga zaledwie 1,42 kg pozwoli Ci zabrać go ze sobą wszędzie, gdzie zechcesz. Zaufaj mobilności bez kompromisów.</p><p>Sprawdź, jak Acer Swift 3 wygląda w rzeczywistości. Chwyć zdjęcie poniżej i przeciągnij je w lewo lub prawo, aby obrócić produkt, lub skorzystaj z przycisków nawigacyjnych.</p><div class='ov360'><div id='orbitvu'> </div></div><template><script type='text/javascript' src='https://blob.stati.pl/ov360/orbitvu12/swfobject.js'></script></template><template><script type='text/javascript' src='https://blob.stati.pl/ov360/orbitvu12/orbitvu.js'></script></template><template><script type='text/javascript'>        inject_orbitvu('orbitvu', 'https://blob.stati.pl/ov360/orbitvu12/orbitvuer12.swf', 'https://blob.stati.pl/ov360/orbitvu12/expressInstall.swf', {            ovus_folder: 'https://xkomstati.blob.core.windows.net/ov360/Systems/Acer/NX.HBBEP.001/',            width: '100%',            content2: 'yes',            height: '100%'        });</script></template></div></div><div class='row text-left fresh-content'><div class='col-md-2 text-center'><img alt='rozdzielczość FullHD' class='ico' src='https://allegro.stati.pl/AllegroIMG/SZABLON/ICONS/FullHD.svg'></div><div class='col-md-10'><h2 class='text-left'>Zobaczyć znaczy uwierzyć</h2><p>Niezwykle cienka ramka zapewnia jeszcze większy obszar wyświetlania we wspaniałej rozdzielczości Full HD. Wyświetlacz wykorzystuje również technologię IPS, zapewniając wyraziste kolory nawet pod kątem 178 stopni. To nie koniec. Dzięki technologii Acer Color Intelligence™ możesz zoptymalizować kolory, jasność i nasycenie.</p><img alt='Niesamowity ekran' src='https://allegro.stati.pl/AllegroIMG/PRODUCENCI/ASUS/Swift-3/02-przod.jpg'></div></div><div class='row text-left fresh-content'><div class='col-md-2 text-center'><img alt='łatwa obsługa' class='ico' src='https://allegro.stati.pl/AllegroIMG/SZABLON/ICONS/latwaobsluga.svg'></div><div class='col-md-10'><h2 class='text-left'>Większa wydajność</h2><p>Niezależnie od tego, czy wykonujesz rutynowe czynności czy najbardziej wymagające zadania, nasze procesory najnowszej generacji dadzą sobie radę. Zanurz się w grze, edytuj zdjęcia i filmy albo po prostu ciesz się doskonałą wydajnością.</p><img alt='Wysoka wydajność' src='https://allegro.stati.pl/AllegroIMG/PRODUCENCI/ASUS/Swift-3/03-tyl.jpg'></div></div><div class='row text-left fresh-content'><div class='col-md-2 text-center'><img alt='bateria' class='ico' src='https://allegro.stati.pl/AllegroIMG/SZABLON/ICONS/bateria.svg'></div><div class='col-md-10'><h2 class='text-left'>Źródło mocy</h2><p>Gdy każdy Twój dzień wypełniają niezliczone zadania, spotkania oraz prezentacje wideo, potrzebujesz urządzenia, które sprosta tym wymaganiom. Dzięki do 12 godzin pracy na baterii ukończysz wszystkie zadania, nadal mając zapas energii.</p><img alt='Pojemna bateria' src='https://allegro.stati.pl/AllegroIMG/PRODUCENCI/ASUS/Swift-3/04-klawiatura.jpg'></div></div><div class='row text-left fresh-content'><div class='col-md-2 text-center'><img alt='sterowanie głosem' class='ico' src='https://allegro.stati.pl/AllegroIMG/SZABLON/ICONS/czytnikliniipapilarnych.svg'></div><div class='col-md-10'><h2 class='text-left'>Po prostu więcej możliwości</h2><p>Dzięki funkcjom umożliwiającym wykonywanie kilku zadań naraz możesz zrobić więcej mniejszym nakładem sił, co wpłynie na Twoją efektywność i poczucie komfortu. Szybkie wykonywanie zadań dzięki usłudze Windows Hello™, która nie wymaga hasła, wspomoże Cię w tym czytnik linii papilarnych. </p><img alt='Windows Hello oraz asystenci głosowi' src='https://allegro.stati.pl/AllegroIMG/PRODUCENCI/ASUS/Swift-3/05-lewy-bok.jpg'></div></div>","https://cdn.x-kom.pl/i/setup/images/prod/big/product-new-big,,2018/8/pr_2018_8_11_20_25_23_903_08.jpg",https://www.x-kom.pl/p/498097-notebook-laptop-141-acer-swift-3-i5-8265u-8gb-512-win10-fhd-ips-mx250-blue.html
